{
  "assessment_engine_version": "1.0.0",
  "assessment_hash": "4a67339c4e7e3ece380d4ae51c8611fa9d18f0012ed337f0d92d7c864b4fca9e",
  "assessment_input_fingerprint": "e11d5abb321888e3a24a58905c669d0e2ba36826e8d148ace6b70789f8e6363b",
  "assessment_output_contract_version": "1.0.0",
  "automatic_trade_execution": false,
  "candidate_identity": {
    "correlation_bucket": "Consumer Growth",
    "country": "United States",
    "issuer_identifier": "0001334036",
    "issuer_name": "Crocs, Inc.",
    "sector": "Consumer",
    "security_identifier": "CROX",
    "security_type": "EQUITY"
  },
  "constraint_snapshot": {
    "binding_constraints": [
      {
        "constraint_id": "sector",
        "maximum_incremental_position_weight": 0.05
      }
    ],
    "ceiling_disclosure_en": "This is the maximum allowed by the tested constraints. It is not an investment instruction or an approved range.",
    "ceiling_disclosure_zh": "该数值仅表示已测试约束允许的最大值，不构成投资指令或已批准区间。",
    "constraints": [
      {
        "binding": false,
        "candidate_value": null,
        "constraint_id": "existing_issuer_exposure",
        "current_value": 0,
        "escalation_threshold": null,
        "escalation_triggered": null,
        "formula": "sum(gross long weights with candidate issuer_identifier)",
        "formula_inputs": {
          "exposure_basis": "COMPLETE_SECURITY_LEVEL_HOLDINGS"
        },
        "label_en": "Existing issuer exposure",
        "label_zh": "现有发行人敞口",
        "limit_value": null,
        "maximum_incremental_position_weight": null,
        "missing_fields": [],
        "notes_en": "Zero is used only when complete holdings or an explicit zero issuer exposure row supports it.",
        "notes_zh": "只有完整持仓或明确的零发行人敞口行支持时，系统才使用零。",
        "remaining_capacity": null,
        "required_for_ceiling": false,
        "source_fields": [
          "constraint_inputs.candidate.issuer_identifier",
          "holdings or exposure_summary"
        ],
        "status": "PASS"
      },
      {
        "binding": false,
        "candidate_value": null,
        "constraint_id": "single_name",
        "current_value": 0,
        "escalation_threshold": 0.8,
        "escalation_triggered": false,
        "formula": "max(0, single_name_position_limit - current_gross_long_weight)",
        "formula_inputs": {
          "current_gross_long_weight": 0,
          "current_limit_utilization": 0.0,
          "single_name_position_limit": 0.1
        },
        "label_en": "Single-name concentration",
        "label_zh": "单一标的集中度",
        "limit_value": 0.1,
        "maximum_incremental_position_weight": 0.1,
        "missing_fields": [],
        "notes_en": "The result is an incremental concentration ceiling, not a position recommendation.",
        "notes_zh": "该结果是新增集中度上限，不是建议仓位。",
        "remaining_capacity": 0.1,
        "required_for_ceiling": true,
        "source_fields": [
          "policy.single_name_position_limit",
          "COMPLETE_SECURITY_LEVEL_HOLDINGS:issuer"
        ],
        "status": "PASS"
      },
      {
        "binding": true,
        "candidate_value": null,
        "constraint_id": "sector",
        "current_value": 0.3,
        "escalation_threshold": 0.8,
        "escalation_triggered": true,
        "formula": "max(0, sector_concentration_limit - current_gross_long_weight)",
        "formula_inputs": {
          "current_gross_long_weight": 0.3,
          "current_limit_utilization": 0.8571428571428572,
          "sector_concentration_limit": 0.35
        },
        "label_en": "Sector concentration",
        "label_zh": "行业集中度",
        "limit_value": 0.35,
        "maximum_incremental_position_weight": 0.05,
        "missing_fields": [],
        "notes_en": "The result is an incremental concentration ceiling, not a position recommendation.",
        "notes_zh": "该结果是新增集中度上限，不是建议仓位。",
        "remaining_capacity": 0.04999999999999999,
        "required_for_ceiling": true,
        "source_fields": [
          "policy.sector_concentration_limit",
          "COMPLETE_SECURITY_LEVEL_HOLDINGS:sector"
        ],
        "status": "PASS"
      },
      {
        "binding": false,
        "candidate_value": null,
        "constraint_id": "correlated_exposure",
        "current_value": 0.3,
        "escalation_threshold": 0.8,
        "escalation_triggered": false,
        "formula": "max(0, correlated_exposure_limit - current_gross_long_weight)",
        "formula_inputs": {
          "correlated_exposure_limit": 0.4,
          "current_gross_long_weight": 0.3,
          "current_limit_utilization": 0.7499999999999999
        },
        "label_en": "Correlated exposure",
        "label_zh": "相关性敞口",
        "limit_value": 0.4,
        "maximum_incremental_position_weight": 0.1,
        "missing_fields": [],
        "notes_en": "The result is an incremental concentration ceiling, not a position recommendation.",
        "notes_zh": "该结果是新增集中度上限，不是建议仓位。",
        "remaining_capacity": 0.10000000000000003,
        "required_for_ceiling": true,
        "source_fields": [
          "policy.correlated_exposure_limit",
          "COMPLETE_SECURITY_LEVEL_HOLDINGS:correlation"
        ],
        "status": "PASS"
      },
      {
        "binding": false,
        "candidate_value": null,
        "constraint_id": "country",
        "current_value": 0.5,
        "escalation_threshold": 0.8,
        "escalation_triggered": false,
        "formula": "max(0, country_concentration_limit - current_gross_long_weight)",
        "formula_inputs": {
          "country_concentration_limit": 0.8,
          "current_gross_long_weight": 0.5,
          "current_limit_utilization": 0.625
        },
        "label_en": "Country concentration",
        "label_zh": "国家集中度",
        "limit_value": 0.8,
        "maximum_incremental_position_weight": 0.3,
        "missing_fields": [],
        "notes_en": "The result is an incremental concentration ceiling, not a position recommendation.",
        "notes_zh": "该结果是新增集中度上限，不是建议仓位。",
        "remaining_capacity": 0.30000000000000004,
        "required_for_ceiling": true,
        "source_fields": [
          "policy.country_concentration_limit",
          "COMPLETE_SECURITY_LEVEL_HOLDINGS:country"
        ],
        "status": "PASS"
      },
      {
        "binding": false,
        "candidate_value": 0.28,
        "constraint_id": "target_return",
        "current_value": null,
        "escalation_threshold": null,
        "escalation_triggered": null,
        "formula": "candidate_validated_return >= policy_target_return",
        "formula_inputs": {
          "candidate_validated_return": 0.28,
          "policy_target_return": 0.2
        },
        "label_en": "Target-return hurdle",
        "label_zh": "目标回报门槛",
        "limit_value": 0.2,
        "maximum_incremental_position_weight": 1.0,
        "missing_fields": [],
        "notes_en": "Public price sensitivity is not accepted as expected return.",
        "notes_zh": "公开的价格敏感性不能作为预期回报。",
        "remaining_capacity": null,
        "required_for_ceiling": true,
        "source_fields": [
          "constraint_inputs.candidate.expected_return",
          "policy.target_return"
        ],
        "status": "PASS"
      },
      {
        "binding": false,
        "candidate_value": 365,
        "constraint_id": "holding_period",
        "current_value": null,
        "escalation_threshold": null,
        "escalation_triggered": null,
        "formula": "candidate_holding_period_days <= policy_holding_period_days",
        "formula_inputs": {
          "candidate_holding_period_days": 365,
          "policy_holding_period_days": 365
        },
        "label_en": "Holding-period limit",
        "label_zh": "持有期上限",
        "limit_value": 365,
        "maximum_incremental_position_weight": 1.0,
        "missing_fields": [],
        "notes_en": "The expected-return and downside horizons must already match.",
        "notes_zh": "预期回报与下行情景的期限必须已经一致。",
        "remaining_capacity": null,
        "required_for_ceiling": true,
        "source_fields": [
          "constraint_inputs.candidate.expected_return.holding_period_days",
          "policy.holding_period_days"
        ],
        "status": "PASS"
      },
      {
        "binding": false,
        "candidate_value": -0.2,
        "constraint_id": "downside",
        "current_value": null,
        "escalation_threshold": 0.8,
        "escalation_triggered": true,
        "formula": "candidate_formal_downside_return >= policy_downside_tolerance",
        "formula_inputs": {
          "candidate_formal_downside_return": -0.2,
          "downside_limit_utilization": 0.8,
          "policy_downside_tolerance": -0.25
        },
        "label_en": "Downside tolerance",
        "label_zh": "下行容忍度",
        "limit_value": -0.25,
        "maximum_incremental_position_weight": 1.0,
        "missing_fields": [],
        "notes_en": "Only a validated dated-horizon downside return is accepted; Bear price sensitivity is excluded.",
        "notes_zh": "只接受经验证、具有明确期限的下行回报；Bear 价格敏感性被排除。",
        "remaining_capacity": null,
        "required_for_ceiling": true,
        "source_fields": [
          "constraint_inputs.candidate.downside_return",
          "policy.downside_tolerance"
        ],
        "status": "PASS"
      },
      {
        "binding": false,
        "candidate_value": 0.7,
        "constraint_id": "liquidity_portfolio_floor",
        "current_value": null,
        "escalation_threshold": null,
        "escalation_triggered": null,
        "formula": "current_liquid_portfolio_weight >= minimum_liquid_portfolio_weight",
        "formula_inputs": {
          "current_liquid_portfolio_weight": 0.7,
          "minimum_liquid_portfolio_weight": 0.25
        },
        "label_en": "Portfolio liquidity floor",
        "label_zh": "组合流动性下限",
        "limit_value": 0.25,
        "maximum_incremental_position_weight": 1.0,
        "missing_fields": [],